{"catalog":{"drivers":[{"id":"U","piece":8,"reader":[{"placement":1854,"stop":0},{"placement":1855,"stop":1},{"placement":1856,"stop":2},{"placement":1857,"stop":3},{"placement":1858,"stop":4},{"placement":1859,"stop":5},{"placement":1860,"stop":6}],"stops":["0","1","2","3","4","5","6"]},{"id":"R","piece":14,"reader":[{"placement":3019,"stop":0},{"placement":3020,"stop":1},{"placement":3021,"stop":2},{"placement":3022,"stop":3},{"placement":3023,"stop":4},{"placement":3024,"stop":5},{"placement":3025,"stop":6}],"stops":["0","1","2","3","4","5","6"]},{"id":"F","piece":18,"reader":[{"placement":3710,"stop":0},{"placement":3711,"stop":1},{"placement":3712,"stop":2},{"placement":3713,"stop":3},{"placement":3714,"stop":4},{"placement":3715,"stop":5},{"placement":3716,"stop":6}],"stops":["0","1","2","3","4","5","6"]},{"id":"L","piece":22,"reader":[{"placement":4167,"stop":0},{"placement":4168,"stop":1},{"placement":4169,"stop":2},{"placement":4170,"stop":3},{"placement":4171,"stop":4},{"placement":4172,"stop":5},{"placement":4173,"stop":6}],"stops":["0","1","2","3","4","5","6"]},{"id":"B","piece":24,"reader":[{"placement":4288,"stop":0},{"placement":4289,"stop":1},{"placement":4290,"stop":2},{"placement":4291,"stop":3},{"placement":4292,"stop":4},{"placement":4293,"stop":5},{"placement":4294,"stop":6}],"stops":["0","1","2","3","4","5","6"]},{"id":"D","piece":25,"reader":[{"placement":4295,"stop":0},{"placement":4296,"stop":1},{"placement":4297,"stop":2},{"placement":4298,"stop":3},{"placement":4299,"stop":4},{"placement":4300,"stop":5},{"placement":4301,"stop":6}],"stops":["0","1","2","3","4","5","6"]}],"families":[{"drivers":["U"],"id":"U","routes":[{"from":["1"],"pathId":"U_h_inv","profile":"turn","request":"U_h_inv","to":["6"]},{"from":["0"],"pathId":"U_g_inv","profile":"turn","request":"U_g_inv","to":["4"]},{"from":["3"],"pathId":"U_g_inv","profile":"turn","request":"U_g_inv","to":["0"]},{"from":["5"],"pathId":"U_g_inv","profile":"turn","request":"U_g_inv","to":["1"]},{"from":["6"],"pathId":"U_g_inv","profile":"turn","request":"U_g_inv","to":["2"]},{"from":["5"],"pathId":"U_f_inv","profile":"turn","request":"U_f_inv","to":["2"]},{"from":["0"],"pathId":"U_e_inv","profile":"turn","request":"U_e_inv","to":["5"]},{"from":["2"],"pathId":"U_e_inv","profile":"turn","request":"U_e_inv","to":["0"]},{"from":["4"],"pathId":"U_e_inv","profile":"turn","request":"U_e_inv","to":["1"]},{"from":["6"],"pathId":"U_e_inv","profile":"turn","request":"U_e_inv","to":["3"]},{"from":["0"],"pathId":"U_inv","profile":"turn","request":"U_inv","to":["6"]},{"from":["1"],"pathId":"U_inv","profile":"turn","request":"U_inv","to":["0"]},{"from":["4"],"pathId":"U_inv","profile":"turn","request":"U_inv","to":["2"]},{"from":["5"],"pathId":"U_inv","profile":"turn","request":"U_inv","to":["3"]},{"from":["3"],"pathId":"U_d_inv","profile":"turn","request":"U_d_inv","to":["1"]},{"from":["6"],"pathId":"U_d_inv","profile":"turn","request":"U_d_inv","to":["4"]},{"from":["3"],"pathId":"U_c_inv","profile":"turn","request":"U_c_inv","to":["2"]},{"from":["5"],"pathId":"U_c_inv","profile":"turn","request":"U_c_inv","to":["4"]},{"from":["4"],"pathId":"U_b_inv","profile":"turn","request":"U_b_inv","to":["3"]},{"from":["2"],"pathId":"U_a_inv","profile":"turn","request":"U_a_inv","to":["1"]},{"from":["6"],"pathId":"U_a_inv","profile":"turn","request":"U_a_inv","to":["5"]},{"from":["1"],"pathId":"U_a","profile":"turn","request":"U_a","to":["2"]},{"from":["5"],"pathId":"U_a","profile":"turn","request":"U_a","to":["6"]},{"from":["3"],"pathId":"U_b","profile":"turn","request":"U_b","to":["4"]},{"from":["2"],"pathId":"U_c","profile":"turn","request":"U_c","to":["3"]},{"from":["4"],"pathId":"U_c","profile":"turn","request":"U_c","to":["5"]},{"from":["1"],"pathId":"U_d","profile":"turn","request":"U_d","to":["3"]},{"from":["4"],"pathId":"U_d","profile":"turn","request":"U_d","to":["6"]},{"from":["0"],"pathId":"U","profile":"turn","request":"U","to":["1"]},{"from":["2"],"pathId":"U","profile":"turn","request":"U","to":["4"]},{"from":["3"],"pathId":"U","profile":"turn","request":"U","to":["5"]},{"from":["6"],"pathId":"U","profile":"turn","request":"U","to":["0"]},{"from":["0"],"pathId":"U_e","profile":"turn","request":"U_e","to":["2"]},{"from":["1"],"pathId":"U_e","profile":"turn","request":"U_e","to":["4"]},{"from":["3"],"pathId":"U_e","profile":"turn","request":"U_e","to":["6"]},{"from":["5"],"pathId":"U_e","profile":"turn","request":"U_e","to":["0"]},{"from":["2"],"pathId":"U_f","profile":"turn","request":"U_f","to":["5"]},{"from":["0"],"pathId":"U_g","profile":"turn","request":"U_g","to":["3"]},{"from":["1"],"pathId":"U_g","profile":"turn","request":"U_g","to":["5"]},{"from":["2"],"pathId":"U_g","profile":"turn","request":"U_g","to":["6"]},{"from":["4"],"pathId":"U_g","profile":"turn","request":"U_g","to":["0"]},{"from":["6"],"pathId":"U_h","profile":"turn","request":"U_h","to":["1"]}]},{"drivers":["R"],"id":"R","routes":[{"from":["1"],"pathId":"R_h_inv","profile":"turn","request":"R_h_inv","to":["6"]},{"from":["0"],"pathId":"R_g_inv","profile":"turn","request":"R_g_inv","to":["4"]},{"from":["3"],"pathId":"R_g_inv","profile":"turn","request":"R_g_inv","to":["0"]},{"from":["5"],"pathId":"R_g_inv","profile":"turn","request":"R_g_inv","to":["1"]},{"from":["6"],"pathId":"R_g_inv","profile":"turn","request":"R_g_inv","to":["2"]},{"from":["5"],"pathId":"R_f_inv","profile":"turn","request":"R_f_inv","to":["2"]},{"from":["0"],"pathId":"R_e_inv","profile":"turn","request":"R_e_inv","to":["5"]},{"from":["2"],"pathId":"R_e_inv","profile":"turn","request":"R_e_inv","to":["0"]},{"from":["4"],"pathId":"R_e_inv","profile":"turn","request":"R_e_inv","to":["1"]},{"from":["6"],"pathId":"R_e_inv","profile":"turn","request":"R_e_inv","to":["3"]},{"from":["0"],"pathId":"R_inv","profile":"turn","request":"R_inv","to":["6"]},{"from":["1"],"pathId":"R_inv","profile":"turn","request":"R_inv","to":["0"]},{"from":["4"],"pathId":"R_inv","profile":"turn","request":"R_inv","to":["2"]},{"from":["5"],"pathId":"R_inv","profile":"turn","request":"R_inv","to":["3"]},{"from":["3"],"pathId":"R_d_inv","profile":"turn","request":"R_d_inv","to":["1"]},{"from":["6"],"pathId":"R_d_inv","profile":"turn","request":"R_d_inv","to":["4"]},{"from":["3"],"pathId":"R_c_inv","profile":"turn","request":"R_c_inv","to":["2"]},{"from":["5"],"pathId":"R_c_inv","profile":"turn","request":"R_c_inv","to":["4"]},{"from":["4"],"pathId":"R_b_inv","profile":"turn","request":"R_b_inv","to":["3"]},{"from":["2"],"pathId":"R_a_inv","profile":"turn","request":"R_a_inv","to":["1"]},{"from":["6"],"pathId":"R_a_inv","profile":"turn","request":"R_a_inv","to":["5"]},{"from":["1"],"pathId":"R_a","profile":"turn","request":"R_a","to":["2"]},{"from":["5"],"pathId":"R_a","profile":"turn","request":"R_a","to":["6"]},{"from":["3"],"pathId":"R_b","profile":"turn","request":"R_b","to":["4"]},{"from":["2"],"pathId":"R_c","profile":"turn","request":"R_c","to":["3"]},{"from":["4"],"pathId":"R_c","profile":"turn","request":"R_c","to":["5"]},{"from":["1"],"pathId":"R_d","profile":"turn","request":"R_d","to":["3"]},{"from":["4"],"pathId":"R_d","profile":"turn","request":"R_d","to":["6"]},{"from":["0"],"pathId":"R","profile":"turn","request":"R","to":["1"]},{"from":["2"],"pathId":"R","profile":"turn","request":"R","to":["4"]},{"from":["3"],"pathId":"R","profile":"turn","request":"R","to":["5"]},{"from":["6"],"pathId":"R","profile":"turn","request":"R","to":["0"]},{"from":["0"],"pathId":"R_e","profile":"turn","request":"R_e","to":["2"]},{"from":["1"],"pathId":"R_e","profile":"turn","request":"R_e","to":["4"]},{"from":["3"],"pathId":"R_e","profile":"turn","request":"R_e","to":["6"]},{"from":["5"],"pathId":"R_e","profile":"turn","request":"R_e","to":["0"]},{"from":["2"],"pathId":"R_f","profile":"turn","request":"R_f","to":["5"]},{"from":["0"],"pathId":"R_g","profile":"turn","request":"R_g","to":["3"]},{"from":["1"],"pathId":"R_g","profile":"turn","request":"R_g","to":["5"]},{"from":["2"],"pathId":"R_g","profile":"turn","request":"R_g","to":["6"]},{"from":["4"],"pathId":"R_g","profile":"turn","request":"R_g","to":["0"]},{"from":["6"],"pathId":"R_h","profile":"turn","request":"R_h","to":["1"]}]},{"drivers":["F"],"id":"F","routes":[{"from":["1"],"pathId":"F_h_inv","profile":"turn","request":"F_h_inv","to":["6"]},{"from":["0"],"pathId":"F_g_inv","profile":"turn","request":"F_g_inv","to":["4"]},{"from":["3"],"pathId":"F_g_inv","profile":"turn","request":"F_g_inv","to":["0"]},{"from":["5"],"pathId":"F_g_inv","profile":"turn","request":"F_g_inv","to":["1"]},{"from":["6"],"pathId":"F_g_inv","profile":"turn","request":"F_g_inv","to":["2"]},{"from":["5"],"pathId":"F_f_inv","profile":"turn","request":"F_f_inv","to":["2"]},{"from":["0"],"pathId":"F_e_inv","profile":"turn","request":"F_e_inv","to":["5"]},{"from":["2"],"pathId":"F_e_inv","profile":"turn","request":"F_e_inv","to":["0"]},{"from":["4"],"pathId":"F_e_inv","profile":"turn","request":"F_e_inv","to":["1"]},{"from":["6"],"pathId":"F_e_inv","profile":"turn","request":"F_e_inv","to":["3"]},{"from":["0"],"pathId":"F_inv","profile":"turn","request":"F_inv","to":["6"]},{"from":["1"],"pathId":"F_inv","profile":"turn","request":"F_inv","to":["0"]},{"from":["4"],"pathId":"F_inv","profile":"turn","request":"F_inv","to":["2"]},{"from":["5"],"pathId":"F_inv","profile":"turn","request":"F_inv","to":["3"]},{"from":["3"],"pathId":"F_d_inv","profile":"turn","request":"F_d_inv","to":["1"]},{"from":["6"],"pathId":"F_d_inv","profile":"turn","request":"F_d_inv","to":["4"]},{"from":["3"],"pathId":"F_c_inv","profile":"turn","request":"F_c_inv","to":["2"]},{"from":["5"],"pathId":"F_c_inv","profile":"turn","request":"F_c_inv","to":["4"]},{"from":["4"],"pathId":"F_b_inv","profile":"turn","request":"F_b_inv","to":["3"]},{"from":["2"],"pathId":"F_a_inv","profile":"turn","request":"F_a_inv","to":["1"]},{"from":["6"],"pathId":"F_a_inv","profile":"turn","request":"F_a_inv","to":["5"]},{"from":["1"],"pathId":"F_a","profile":"turn","request":"